{
  "batteryCategory": "LMT",
  "productIdentifier": "eOMtThyhVNLWUZNRcBaQKxI",
  "productPassportIdentifier": "\"urn:uuid:d2bFB3aC-C7b4-2C1E-5b74-D\"",
  "batteryStatus": "original",
  "manufacturerID": "yedUsFwdkelQbxeTeQOvaScfqIOOmaa",
  "manufacturingDate": "2023-08-24T11:11:29.790+02:00",
  "batteryWeight": 0,
  "manufacturingPlace": {
    "addressCountry": "Germany",
    "streetAddress": "Hindenburgstr. 10",
    "postalCode": "30890"
  }
}